{"authority_event_count":47,"authority_head":"event_171eba103eac75e998493576891d66e7","book_id":"book_demo","ced":{"advisory_findings_excluded":1,"chapter_count":3,"definition":"hard consistency errors per chapter in one fixed contiguous three-chapter window","density":0.0,"end":"ch_003","error_count":0,"start":"ch_001","window_size":3},"chapter_count":3,"chapters":[{"advisory_finding_count":0,"authority_parent":"event_954c24685bc28defa544c779fb01b98a","chapter_hash":"sha256:92b0b6af8bf8850ac7e01f4a1aa091d5ed131d8866248c6f0bf78b56e2cb13ba","chapter_id":"ch_001","commit_hash":"sha256:3b03027a15421096a393ba80f18a94117e4216913e1b9b43765858d7296c74da","commit_head":"event_fdc89f14ee4eaea78892934e463359f1","event_count":5,"event_ids":["event_562c4f95d21ea924766af4d9463914a1","event_d96b316ed955ed51c5229a642e9cd0fd","event_baa4c6d77f4dbd9c06cc240f4369672e","event_2d1249887c68226e0a5a3ebcfffade01","event_fdc89f14ee4eaea78892934e463359f1"],"hard_error_count":0,"run_id":"run_f1ae09c95f13bfbfc0d2ee96"},{"advisory_finding_count":1,"authority_parent":"event_fdc89f14ee4eaea78892934e463359f1","chapter_hash":"sha256:05dffe9d2764c24663bb5f043a5c2fecdbf0eff54ec92b7b4cbc5bd9ebd57e02","chapter_id":"ch_002","commit_hash":"sha256:ecd79b2e711b3f1ac50493fc44d3e82ae9b6c4208918b1ab6ef9522c182e4438","commit_head":"event_6bce9186b3ccf4c21c32ce211351e3c1","event_count":5,"event_ids":["event_658276ce90afd285021174492df7d62f","event_af7e213c3d3380310ca12fb8a15d534b","event_71623fa248cc2fce5a5240b2ca8ebb62","event_cd56b8d6d8799d94b5692d7bc6749fe7","event_6bce9186b3ccf4c21c32ce211351e3c1"],"hard_error_count":0,"run_id":"run_b663cb99b96afd615443121e"},{"advisory_finding_count":0,"authority_parent":"event_6bce9186b3ccf4c21c32ce211351e3c1","chapter_hash":"sha256:36e62690a2376b8cb79db51b171c9052a3cac2348d2d85b786f6a3640598f811","chapter_id":"ch_003","commit_hash":"sha256:66c012fc086c9d155041fbc48484dd153bc58a52215ecfdffb89ef8cecbac11f","commit_head":"event_171eba103eac75e998493576891d66e7","event_count":5,"event_ids":["event_4e1c81f149da04dafdaa75b69c7e1b6e","event_e66ab4f7c2e598bc732014dad66576dc","event_1db306f3b0f8abdebf49088b3e14a0f8","event_a21eb06df268113b2ead0cb4823be966","event_171eba103eac75e998493576891d66e7"],"hard_error_count":0,"run_id":"run_965b140e00f2cf4c352721ff"}],"fact_count":4,"initial_authority_event_count":32,"loss_checks":{"authority_chain_contiguous":true,"authority_count_conserved":true,"chapter_count_conserved":true,"chapter_ids_conserved":true,"fact_count_conserved":true,"projection_facts_conserved":true,"projection_head_conserved":true,"run_receipts_conserved":true},"report_hash":"sha256:a7400cf8fc5a9ecfadc88873a7c533a287b75944243d1d33ab12d2bc7738ca4e","schema_version":"three-chapter-smoke-report.v1","scope":{"challenge_false_negatives_changed":false,"hard_gate_promoted":false,"reliability_claim":"three-chapter smoke only"},"silent_data_loss":false,"snapshot":{"head_event_id":"event_6bce9186b3ccf4c21c32ce211351e3c1","lineage_event_count":42,"projection_state_hash":"sha256:655cbcfeb72f0100e7117de556159ac12d8620e29f8b444171cab53433522342","restored_before_chapter_three":true,"snapshot_id":"snapshot_10dd7064b0704a3288ce1d33ed1d9b01"},"transaction_recovery":{"interruption_injected":true,"interruption_observed":true,"recovered":true}}